{
  "schemaVersion": 1,
  "contractVersion": "0.1.0",
  "contractId": "islands-sunrise-studio-compatibility",
  "projectName": "Island's Sunrise",
  "profileId": "islands-sunrise",
  "profileChain": ["generic-dendry", "sdaah-style", "islands-sunrise"],
  "studioProfilePath": "tools/project_map/profiles/islands-sunrise.json",
  "parserFixtureRoot": "studio_contract/parser_fixture",
  "requiredInvariants": ["INV-B001", "INV-C002", "INV-V001", "INV-V002"],
  "stableRouters": [
    "source/scenes/root.scene.dry",
    "source/scenes/post_event.scene.dry",
    "source/scenes/post_event_news.scene.dry"
  ],
  "semanticSystems": [
    "district_v3",
    "local_governance",
    "collective_v2",
    "identity_profile",
    "founding_deliberation",
    "circle",
    "strategic_sidebar"
  ],
  "variableFamilies": [
    "local_county_result",
    "local_county_governance",
    "district_v3",
    "collective_graph",
    "coverage_v2",
    "founding_hooks",
    "party_factions"
  ],
  "protectedBoundaries": [
    "coverage_region_granularity",
    "district_result_read_only",
    "post_event_targeted_reads_only"
  ],
  "protectedPathPrefixes": [
    "out/html/",
    "out/game.json",
    ".git/"
  ],
  "installBoundary": {
    "sourceBackedSingleLineText": "guarded_apply",
    "newWorldEventWithAnchors": "guarded_apply",
    "denseRouterWithoutAnchor": "manual_review",
    "protectedRuntimeUi": "ide_escape_hatch",
    "coveragePopulationWrites": "refused"
  },
  "parserFixtureExpectations": {
    "profileIds": ["generic-dendry", "sdaah-style", "islands-sunrise"],
    "minSummary": {
      "sceneCount": 7,
      "edgeCount": 7,
      "variableCount": 20,
      "eventCount": 1,
      "newsItemCount": 0
    },
    "requiredScenes": [
      "root",
      "post_event",
      "post_event_news",
      "contract_event",
      "election_algorithm",
      "collective_graph",
      "sdp_circle",
      "local_governance_menu",
      "status"
    ],
    "requiredVariables": [
      "profile_sdp_sovereignty",
      "local_county_result_year",
      "local_county_governance_demo",
      "district_demo_seats_v3",
      "collective_1_stage",
      "edge_1_2_exists",
      "tag_labor",
      "cov_R1_labor_d",
      "apathy_R1_labor_state",
      "mobilization_R1_labor",
      "party_capture_R1_labor_sdp",
      "circle_labor_trust",
      "democratic_infra_branches",
      "founding_committee",
      "diplomatic_pressure",
      "china_pressure",
      "defense_readiness",
      "crisis_alert",
      "contract_demo_seen"
    ]
  }
}
